{
  "viewerRuntimeVersion": "viewer-runtime-v0.1.0",
  "scanId": "fixture-clean",
  "resultId": "r_1cfe0f4e9ea34cb2a1d518237e721d30",
  "resultPath": "/r/r_1cfe0f4e9ea34cb2a1d518237e721d30",
  "mappingVersion": "mapping-v0.1.0",
  "sourceHashes": {
    "scanRecordSha256": "12d678f250785a62e69d22c28c19793a3b3951a830eb2d435f3dc98aaa89daa2",
    "sceneManifestSha256": "264c19fe87d40acea8c904a0f28ad73b7c9593a904759ec21ef2ba21332ac373",
    "mappingRegistrySha256": "0bef2b6c6e0fe01af279db865b9e29982507bdfcf5fd694b3c57495770c4a472",
    "resultBindingSha256": "7fc7bda5fe3cc54cdb7eaf6e327cd6e68392fcbe366531c21c746ab6ec49bbe8",
    "resultManifestSha256": "e90a746071c72bc5efd8b95a9fa7bf5741f9c593fbc8038bc2602a8876cc1d3e"
  },
  "accessPaths": [
    {
      "id": "webgl",
      "requiresSceneRendering": true,
      "usesSameEvidence": true
    },
    {
      "id": "reduced-motion",
      "requiresSceneRendering": false,
      "usesSameEvidence": true
    },
    {
      "id": "text",
      "requiresSceneRendering": false,
      "usesSameEvidence": true
    }
  ],
  "presentation": {
    "pageLabel": "clean.example",
    "status": "complete",
    "failureCode": null,
    "statusLabel": "COMPLETE CAPTURE",
    "partialLabelRequired": false,
    "shareState": "link-only",
    "finding": {
      "kind": "neutral",
      "statement": "No standout finding was captured for this load.",
      "shareEligible": false,
      "resultRef": null,
      "recordRef": "#/capture"
    },
    "limitationResultRefs": []
  },
  "playback": {
    "durationMs": 5000,
    "stages": [
      {
        "id": "flat",
        "startMs": 0,
        "endMs": 700,
        "meaning": "captured-page orientation",
        "targetChannels": {
          "page": 1.0,
          "structure": 0.0,
          "weight": 0.0,
          "origins": 0.0,
          "finding": 0.0
        }
      },
      {
        "id": "structure",
        "startMs": 700,
        "endMs": 1700,
        "meaning": "DOM structure separates",
        "targetChannels": {
          "page": 1.0,
          "structure": 1.0,
          "weight": 0.0,
          "origins": 0.0,
          "finding": 0.0
        }
      },
      {
        "id": "weight",
        "startMs": 1700,
        "endMs": 3200,
        "meaning": "known transferred bytes acquire mass",
        "targetChannels": {
          "page": 1.0,
          "structure": 1.0,
          "weight": 1.0,
          "origins": 0.0,
          "finding": 0.0
        }
      },
      {
        "id": "party",
        "startMs": 3200,
        "endMs": 4200,
        "meaning": "third-party domain hubs enter",
        "targetChannels": {
          "page": 1.0,
          "structure": 1.0,
          "weight": 1.0,
          "origins": 1.0,
          "finding": 0.0
        }
      },
      {
        "id": "hero",
        "startMs": 4200,
        "endMs": 5000,
        "meaning": "camera locks and hero evidence appears",
        "targetChannels": {
          "page": 1.0,
          "structure": 1.0,
          "weight": 1.0,
          "origins": 1.0,
          "finding": 1.0
        }
      }
    ],
    "reducedMotion": {
      "mode": "five-user-advanced-steps",
      "stepOrder": [
        "flat",
        "structure",
        "weight",
        "party",
        "hero"
      ],
      "cameraMotion": false,
      "continuousGeometryMotion": false
    },
    "rendererOwned": [
      "camera-pose",
      "easing",
      "lighting",
      "material-interpolation"
    ]
  },
  "modes": [
    {
      "id": "structure",
      "label": "STRUCTURE",
      "emphasizes": [
        "structure"
      ],
      "preserves": [
        "object-membership",
        "geometry",
        "measurements",
        "endpoints"
      ]
    },
    {
      "id": "weight",
      "label": "WEIGHT",
      "emphasizes": [
        "weight"
      ],
      "preserves": [
        "object-membership",
        "geometry",
        "measurements",
        "endpoints"
      ]
    },
    {
      "id": "origins",
      "label": "ORIGINS",
      "emphasizes": [
        "origins"
      ],
      "preserves": [
        "object-membership",
        "geometry",
        "measurements",
        "endpoints"
      ]
    }
  ],
  "selectables": [
    {
      "id": "region:n-body",
      "kind": "region",
      "label": "PAGE REGION",
      "renderable": true,
      "sceneRefs": [
        "#/objects/0"
      ],
      "recordRefs": [
        "#/nodes/0",
        "#/mappingVersion"
      ],
      "mappingRefs": [
        "#/scene/coordinateRule",
        "#/structure/depthRule",
        "#/structure/zRule"
      ],
      "resultRefs": [],
      "limitationRefs": [],
      "emphasisChannels": [
        "structure"
      ]
    },
    {
      "id": "region:n-header",
      "kind": "aggregate",
      "label": "AGGREGATED REGION",
      "renderable": true,
      "sceneRefs": [
        "#/objects/1"
      ],
      "recordRefs": [
        "#/nodes/1",
        "#/mappingVersion"
      ],
      "mappingRefs": [
        "#/scene/coordinateRule",
        "#/structure/depthRule",
        "#/structure/zRule",
        "#/structure/aggregationRule"
      ],
      "resultRefs": [],
      "limitationRefs": [],
      "emphasisChannels": [
        "structure"
      ]
    },
    {
      "id": "region:n-logo",
      "kind": "region",
      "label": "PAGE REGION",
      "renderable": true,
      "sceneRefs": [
        "#/objects/2"
      ],
      "recordRefs": [
        "#/nodes/2",
        "#/mappingVersion"
      ],
      "mappingRefs": [
        "#/scene/coordinateRule",
        "#/structure/depthRule",
        "#/structure/zRule",
        "#/weight"
      ],
      "resultRefs": [],
      "limitationRefs": [],
      "emphasisChannels": [
        "structure",
        "weight"
      ]
    },
    {
      "id": "region:n-main",
      "kind": "aggregate",
      "label": "AGGREGATED REGION",
      "renderable": true,
      "sceneRefs": [
        "#/objects/3"
      ],
      "recordRefs": [
        "#/nodes/3",
        "#/mappingVersion"
      ],
      "mappingRefs": [
        "#/scene/coordinateRule",
        "#/structure/depthRule",
        "#/structure/zRule",
        "#/structure/aggregationRule"
      ],
      "resultRefs": [],
      "limitationRefs": [],
      "emphasisChannels": [
        "structure"
      ]
    },
    {
      "id": "bus:page",
      "kind": "page-bus",
      "label": "PAGE RESOURCE BUS",
      "renderable": true,
      "sceneRefs": [
        "#/objects/4"
      ],
      "recordRefs": [
        "#/page/registrableDomain",
        "#/resources"
      ],
      "mappingRefs": [
        "#/party/pageBusPlacementRule"
      ],
      "resultRefs": [],
      "limitationRefs": [],
      "emphasisChannels": [
        "origins"
      ]
    },
    {
      "id": "connection:r-document",
      "kind": "resource-path",
      "label": "RESOURCE PATH",
      "renderable": true,
      "sceneRefs": [
        "#/connections/0"
      ],
      "recordRefs": [
        "#/resources/0",
        "#/mappingVersion"
      ],
      "mappingRefs": [
        "#/party/classificationRule",
        "#/party/knownCableThicknessRule"
      ],
      "resultRefs": [],
      "limitationRefs": [],
      "emphasisChannels": [
        "weight",
        "origins"
      ]
    },
    {
      "id": "connection:r-style",
      "kind": "resource-path",
      "label": "RESOURCE PATH",
      "renderable": true,
      "sceneRefs": [
        "#/connections/1"
      ],
      "recordRefs": [
        "#/resources/1",
        "#/mappingVersion"
      ],
      "mappingRefs": [
        "#/party/classificationRule",
        "#/party/knownCableThicknessRule"
      ],
      "resultRefs": [],
      "limitationRefs": [],
      "emphasisChannels": [
        "weight",
        "origins"
      ]
    },
    {
      "id": "connection:r-font",
      "kind": "resource-path",
      "label": "RESOURCE PATH",
      "renderable": true,
      "sceneRefs": [
        "#/connections/2"
      ],
      "recordRefs": [
        "#/resources/2",
        "#/mappingVersion"
      ],
      "mappingRefs": [
        "#/party/classificationRule",
        "#/party/knownCableThicknessRule"
      ],
      "resultRefs": [],
      "limitationRefs": [],
      "emphasisChannels": [
        "weight",
        "origins"
      ]
    },
    {
      "id": "connection:r-logo",
      "kind": "resource-path",
      "label": "RESOURCE PATH",
      "renderable": true,
      "sceneRefs": [
        "#/connections/3"
      ],
      "recordRefs": [
        "#/resources/3",
        "#/mappingVersion"
      ],
      "mappingRefs": [
        "#/party/classificationRule",
        "#/party/knownCableThicknessRule"
      ],
      "resultRefs": [],
      "limitationRefs": [],
      "emphasisChannels": [
        "weight",
        "origins"
      ]
    },
    {
      "id": "finding:summary",
      "kind": "neutral-summary",
      "label": "CAPTURE SUMMARY",
      "renderable": false,
      "sceneRefs": [],
      "recordRefs": [
        "#/capture",
        "#/page/registrableDomain"
      ],
      "mappingRefs": [
        "#/heroSelection/fallback",
        "#/heroSelection/fallbackShareEligible"
      ],
      "resultRefs": [
        "#/status",
        "#/failureCode",
        "#/shareState"
      ],
      "limitationRefs": [],
      "emphasisChannels": [
        "finding"
      ]
    },
    {
      "id": "status:capture",
      "kind": "capture-status",
      "label": "CAPTURE STATUS",
      "renderable": false,
      "sceneRefs": [
        "#/status",
        "#/failureCode",
        "#/limitations"
      ],
      "recordRefs": [
        "#/status",
        "#/failureCode",
        "#/limitations"
      ],
      "mappingRefs": [],
      "resultRefs": [
        "#/statusPresentation",
        "#/limitations"
      ],
      "limitationRefs": [],
      "emphasisChannels": [
        "finding"
      ]
    }
  ],
  "initialStates": {
    "standard": {
      "motion": "standard",
      "phase": "revealing",